{
  "$schema": "https://json-schema.org/draft/2020-12/schema",
  "$id": "https://github.com/EndeavorEverlasting/BlacksmithGuild/schemas/harness/agent-routing-manifest.schema.json",
  "type": "object",
  "additionalProperties": false,
  "required": ["schema_version", "schema_path", "default_route", "ambiguity_policy", "routes"],
  "properties": {"schema_version": {"const": "tbg-agent-routing-manifest/v1"}, "schema_path": {"type": "string"}, "default_route": {"type": "object"}, "ambiguity_policy": {"const": "fail-closed-to-repository-sprint"}, "routes": {"type": "array", "minItems": 6}}
}
